{
  "schema_version": "v1",
  "run_id": "devops-customer_master-20261022T144820Z",
  "workload_name": "customer_master",
  "started_at": "2026-10-22T14:48:20Z",
  "template_version": "1.0.0",
  "current_phase": "0",
  "random_seed": 42,
  "timestamp_mode": "fixed",
  "human_answers": {
    "zones": [
      "bronze",
      "silver",
      "gold"
    ],
    "recorded_at": "2026-10-22T14:48:20Z",
    "iac_target_framework": "terraform",
    "iac_tbac_principals": [
      {
        "role_arn": "arn:aws:iam::111122223333:role/adop-glue-service",
        "allowed_classifications": [
          "NONE",
          "LOW",
          "MEDIUM"
        ]
      },
      {
        "role_arn": "arn:aws:iam::111122223333:role/adop-analyst",
        "allowed_classifications": [
          "NONE",
          "LOW"
        ]
      }
    ],
    "notes": [
      "Backend: S3 plus DynamoDB.",
      "Apply mode: manual generation only.",
      "Alert channel: SNS email subscription to data-alerts@example.com.",
      "Alert thresholds: defaults.",
      "CloudWatch dashboard: enabled.",
      "Cost tags: team=data-engineering, project=adop, environment=dev, workload=customer_master.",
      "Monthly budget limit: 200 USD.",
      "Log retention: regulation-driven.",
      "On-call team: data-engineering.",
      "Escalation: team lead after 30 minutes.",
      "Known failure: S3 permission errors after key rotation.",
      "RTO: 60 minutes."
    ]
  }
}
